{
  "$schema": "https://json-schema.org/draft/2020-12/schema",
  "$id": "https://omafit.local/schemas/ar-manifest-v1.json",
  "title": "Omafit AR manifest v1",
  "type": "object",
  "additionalProperties": true,
  "properties": {
    "schemaVersion": { "type": "integer", "minimum": 1 },
    "category": { "type": "string" },
    "runtimeProfile": {
      "type": "object",
      "properties": {
        "version": { "type": "string" }
      }
    },
    "coordinateSystem": {
      "type": "object",
      "properties": {
        "handedness": { "type": "string", "enum": ["right-handed", "left-handed"] },
        "forwardAxis": { "type": "string" },
        "upAxis": { "type": "string" }
      }
    },
    "cameraSpace": {
      "type": "object",
      "properties": {
        "mirroredInput": { "type": "boolean" },
        "trackerSpace": { "type": "string" }
      }
    },
    "attachmentSpace": {
      "type": "string",
      "enum": [
        "wrist_local",
        "face_bridge",
        "neck_base",
        "ear_lobe",
        "finger_ring"
      ]
    },
    "wearAnchor": { "type": "object" },
    "fitProxy": {
      "type": "object",
      "description": "Dimensões físicas de encaixe (prevalecem sobre heurística de geometria em runtime).",
      "properties": {
        "innerRadiusMm": { "type": "number", "minimum": 18, "maximum": 85 },
        "innerDiameterMm": { "type": "number", "minimum": 36, "maximum": 170 },
        "innerRadiusM": { "type": "number", "minimum": 0.018, "maximum": 0.085 },
        "ringHoleAxisLocal": {
          "type": "array",
          "items": { "type": "number" },
          "minItems": 3,
          "maxItems": 3
        },
        "axisLocal": {
          "type": "array",
          "items": { "type": "number" },
          "minItems": 3,
          "maxItems": 3
        },
        "ringCenterLocal": {
          "type": "array",
          "items": { "type": "number" },
          "minItems": 3,
          "maxItems": 3,
          "description": "Centro do furo em espaço local do GLB (m); recentramento em fitWristGlb."
        },
        "holeCenterLocal": {
          "type": "array",
          "items": { "type": "number" },
          "minItems": 3,
          "maxItems": 3,
          "description": "Alias de ringCenterLocal."
        }
      }
    },
    "wearableClass": {
      "type": "string",
      "description": "Classe decidida no ingest (ex. bracelet_bangle). Usado com template_certified."
    },
    "materialProfile": {
      "type": "object",
      "description": "Perfil de materiais (óculos: lentes). Definido no ingest Rodin/Blender.",
      "properties": {
        "lensType": {
          "type": "string",
          "enum": ["clear_fake", "tinted", "mirror", "clear_physical"]
        },
        "renderMode": {
          "type": "string",
          "enum": ["lite", "pmrem", "auto"]
        }
      }
    },
    "ingest": {
      "type": "object",
      "properties": {
        "provider": { "type": "string" },
        "wearableClass": { "type": "string" },
        "shopDomain": { "type": "string" },
        "assetId": { "type": "string" }
      }
    },
    "certifiedTemplate": {
      "type": "object",
      "properties": {
        "id": { "type": "string" },
        "version": { "type": "integer" },
        "geometryGlbUrl": { "type": "string" }
      }
    },
    "occlusionProxy": { "type": "object" },
    "occlusionPolicy": {
      "type": "object",
      "properties": {
        "updateMode": { "type": "string" },
        "maxHz": { "type": "number" },
        "decoupleFromRender": { "type": "boolean" }
      }
    },
    "scaleProfile": {
      "type": "object",
      "properties": {
        "assetScaleNormalization": { "type": "number" },
        "bodyFitScaleMultiplier": { "type": "number" }
      }
    },
    "worldScaleContract": { "type": "object" },
    "trackingProfile": { "type": "object" },
    "trackingRecovery": { "type": "object" },
    "smoothing": { "type": "object" },
    "physicalConstraints": { "type": "object" },
    "deviceTierPolicy": { "type": "object" },
    "degradationUX": { "type": "object" },
    "cameraDepthHints": { "type": "object" },
    "memoryBudgetHint": { "type": "object" },
    "meshPolicy": {
      "type": "object",
      "properties": {
        "skinnedMesh": { "type": "string" },
        "deformationPolicy": {
          "type": "string",
          "enum": ["rigid", "adaptive"],
          "description": "rigid: pulseira como corpo rígido (escala uniforme, sem wrap procedural). adaptive: elipse + radial opcional + elos."
        },
        "braceletTopology": {
          "type": "string",
          "enum": ["auto", "bangle", "chain"],
          "description": "auto: heurística. bangle|chain: força classificação (prevalece sobre detectBraceletBangle)."
        },
        "fittingMode": {
          "type": "string",
          "enum": ["hybrid", "strict"],
          "description": "strict: sem rotação bbox/wrap pulseira, sem dobra relógio plano, sem radial instanced, sem percentil de vértices (só fitProxy + fallback bbox 0,92×)."
        },
        "runtimeMode": {
          "type": "string",
          "enum": ["default", "template_certified"],
          "description": "template_certified: GLB certificado + manifest gate; sem heurísticas destrutivas quando lock activo."
        },
        "templateLockTransform": {
          "type": "boolean",
          "description": "Se true (ou implícito com template_certified): sem 2º reset bbox/quat, sem elipse adaptativa. false só debug interno."
        }
      }
    },
    "runtimeFallback": { "type": "object" }
  }
}
