{
  "schemaVersion": 1,
  "category": "bracelet",
  "runtimeProfile": { "version": "ar-runtime-v1" },
  "attachmentSpace": "wrist_local",
  "scaleProfile": {
    "assetScaleNormalization": 1,
    "bodyFitScaleMultiplier": 1
  },
  "trackingRecovery": {
    "lostFramesThreshold": 8,
    "stableFramesThreshold": 5
  },
  "smoothing": {
    "positionDecayPerSec": 12,
    "rotationDecayPerSec": 8,
    "scaleDecayPerSec": 6
  },
  "occlusionPolicy": {
    "updateMode": "tracked",
    "maxHz": 45,
    "decoupleFromRender": true
  },
  "meshPolicy": {
    "skinnedMesh": "warn_v1",
    "deformationPolicy": "rigid",
    "braceletTopology": "auto",
    "fittingMode": "hybrid",
    "runtimeMode": "default"
  },
  "fitProxy": {
    "innerDiameterMm": 62,
    "ringHoleAxisLocal": [0, 0, 1],
    "ringCenterLocal": [0, 0, 0]
  },
  "materialProfile": {
    "renderMode": "lite"
  },
  "occlusionProxy": {
    "type": "wrist_cylinder",
    "radiusScale": 0.93,
    "radiusFromFitProxy": true
  },
  "occlusionPolicy": {
    "mode": "depth",
    "updateMode": "tracked",
    "maxHz": 45
  }
}
